{
  "schema_version": "0.1",
  "kind": "rust_repair_trust_corpus",
  "description": "Governed real-repository Rust repair attempts for trust and adoption evidence.",
  "authorization": {
    "status": "complete",
    "authorization_ref": "user-direction:2026-07-13-internal-adopting-test-repositories-refresh",
    "repositories": [
      {
        "name": "EffortlessMetrics/ripr-swarm",
        "authorization_ref": "user-direction:2026-07-13-internal-adopting-test-repositories-refresh",
        "authorized_revision_or_branch": "origin/main@ce595af48015526318df596d8a73b0174ee17b7b",
        "authorized_observation_heads": [
          "0db4754aa57845d9473ada2e73f40ede2d75138f",
          "11192c85cbf5016aaf45d44abd9ce53e0b7557d7",
          "86fbe048eeedd0eeb6090db96355791c40b3486b",
          "2f71673f9c2da4532a1c1fb8e011dc6fd586ad2f"
        ],
        "allowed_artifact_paths": ["target/ripr/**", "target/receipts/**"],
        "allowed_analysis_actions": ["read_source", "run_ripr", "run_targeted_rerun", "run_focused_verification", "write_receipt"],
        "write_policy": "RIPR does not edit production code or push consumer changes; test-only edits require per-attempt operator approval.",
        "authorization_date": "2026-07-12"
      },
      {
        "name": "EffortlessMetrics/perl-lsp-swarm",
        "authorization_ref": "user-direction:2026-07-13-internal-adopting-test-repositories-refresh",
        "authorized_revision_or_branch": "origin/main@22c61245c3e80ef2d07eaf196d94f6fdd3f0d68a",
        "authorized_observation_heads": [
          "f4b3095e81f16a2e931acccaf2a5d479719fbdfc",
          "81025bcc89515eb30659e1e7388927d2bb1f9d99",
          "968464954e5da8e69a0b6b55de8ac349056924f6",
          "6f175766ee03921a7ae13887d915ce9331647516"
        ],
        "allowed_artifact_paths": ["target/ripr/**", "target/receipts/**"],
        "allowed_analysis_actions": ["read_source", "run_ripr", "run_targeted_rerun", "run_focused_verification", "write_receipt"],
        "write_policy": "RIPR does not edit production code or push consumer changes; test-only edits require per-attempt operator approval.",
        "authorization_date": "2026-07-12"
      },
      {
        "name": "EffortlessMetrics/ub-review",
        "authorization_ref": "user-direction:2026-07-13-internal-adopting-test-repositories-refresh",
        "authorized_revision_or_branch": "origin/main@7abfb093a32bad67019f94b8d33bf04ec2b0621d",
        "authorized_observation_heads": [
          "98aea1868f92c6c0ffe89d9faae83fba11de3019",
          "fc486dc2be564c34b3047e4b5e90accc853ec13e",
          "217633ca232120a021c7dc975973abdcb5056d39",
          "84a365e4f509c866e01b51cbd5e5ae0c22b7302b"
        ],
        "allowed_artifact_paths": ["target/ripr/**", "target/receipts/**"],
        "allowed_analysis_actions": ["read_source", "run_ripr", "run_targeted_rerun", "run_focused_verification", "write_receipt"],
        "write_policy": "RIPR does not edit production code or push consumer changes; test-only edits require per-attempt operator approval.",
        "authorization_date": "2026-07-12"
      }
    ]
  },
  "cases": [],
  "exclusions": [
    {
      "exclusion_id": "pilot-ripr-main-timeout",
      "repository": "EffortlessMetrics/ripr-swarm",
      "analyzed_head_sha": "a53d815416785c37e0d0e067c3b10d3bbfd04a8d",
      "source_ref": "current-main-pilot-2026-07-12",
      "reason": "analysis_timeout",
      "evidence_ref": "target/ripr/pilot/pilot-summary.json",
      "command": "ripr pilot --root . --out target/ripr/pilot --mode draft --max-seams 20 --timeout-ms 120000",
      "claim_boundary": "Repo-wide pilot timed out; no route or attempt denominator was inferred."
    },
    {
      "exclusion_id": "pilot-perl-main-timeout",
      "repository": "EffortlessMetrics/perl-lsp-swarm",
      "analyzed_head_sha": "724bfe819d4e0ba6a5a31a0d5499cc9855f2c231",
      "source_ref": "current-main-pilot-2026-07-12",
      "reason": "analysis_timeout",
      "evidence_ref": "target/ripr/pilot/pilot-summary.json",
      "command": "ripr pilot --root . --out target/ripr/pilot --mode draft --max-seams 20 --timeout-ms 120000",
      "claim_boundary": "Repo-wide pilot timed out; no route or attempt denominator was inferred."
    },
    {
      "exclusion_id": "pilot-ub-main-timeout",
      "repository": "EffortlessMetrics/ub-review",
      "analyzed_head_sha": "9838259a704a5cf3748eb81af29536b99bf7cf3b",
      "source_ref": "current-main-pilot-2026-07-12",
      "reason": "analysis_timeout",
      "evidence_ref": "target/ripr/pilot/pilot-summary.json",
      "command": "ripr pilot --root . --out target/ripr/pilot --mode draft --max-seams 20 --timeout-ms 120000",
      "claim_boundary": "Repo-wide pilot timed out; no route or attempt denominator was inferred."
    },
    {
      "exclusion_id": "ripr-1555-static-limitation",
      "repository": "EffortlessMetrics/ripr-swarm",
      "analyzed_head_sha": "b3a148cb680ed7ec23bd61cef4a070ea322b16b3",
      "source_ref": "PR #1555",
      "reason": "static_limitation_no_repair_packet",
      "evidence_ref": "target/ripr/workflow/ripr1555-crate-comments.json",
      "command": "ripr review-comments --root crates/ripr --base b921b69adc8572fbb9702869e4e0bb6490ab9f1a --head HEAD",
      "claim_boundary": "Changed analyzer code produced predicate limitations; no complete test-only route was counted."
    },
    {
      "exclusion_id": "perl-3939-static-limitation",
      "repository": "EffortlessMetrics/perl-lsp-swarm",
      "analyzed_head_sha": "899c383b18b36b027e47693030c7ddcce84c65a7",
      "source_ref": "PR #3939",
      "reason": "static_limitation_no_repair_packet",
      "evidence_ref": "target/ripr/workflow/perl3939-parser-comments.json",
      "command": "ripr review-comments --root crates/perl-parser-core --base b13b3b0260e6f4b77b522528361991fb714de5fa --head HEAD",
      "claim_boundary": "Parser change produced activation/call-presence limitations; no complete test-only route was counted."
    },
    {
      "exclusion_id": "perl-3908-static-limitation",
      "repository": "EffortlessMetrics/perl-lsp-swarm",
      "analyzed_head_sha": "4d7436bb1703d6950c80a57f5f1487262889de59",
      "source_ref": "PR #3908",
      "reason": "static_limitation_no_repair_packet",
      "evidence_ref": "target/ripr/workflow/perl3908-comments.json",
      "command": "ripr review-comments --root crates/perl-parser-core --base 19df2108b88c7413c50d6b19791d3193451b5511 --head HEAD",
      "claim_boundary": "Parser change produced activation-unknown limitations; no complete test-only route was counted."
    },
    {
      "exclusion_id": "ub-751-callpresence-limitation",
      "repository": "EffortlessMetrics/ub-review",
      "analyzed_head_sha": "458fa3535972c463da1532062a939f97c04828b4",
      "source_ref": "PR #751",
      "reason": "static_limitation_no_repair_packet",
      "evidence_ref": "target/ripr/workflow/pr751-comments.json",
      "command": "ripr review-comments --root . --base 6d2837252793720de9e79415261d174442e6ff43e --head HEAD",
      "claim_boundary": "CallPresence seams remained static_limitation; no repair receipt was run."
    },
    {
      "exclusion_id": "ub-749-callpresence-limitation",
      "repository": "EffortlessMetrics/ub-review",
      "analyzed_head_sha": "5b01e6d19554cb4e5fe94559d487a16455d98235",
      "source_ref": "PR #749",
      "reason": "static_limitation_no_repair_packet",
      "evidence_ref": "target/ripr/workflow/ub749-comments.json",
      "command": "ripr review-comments --root . --base fc486dc2be564c34b3047e4b5e90accc853ec13e --head HEAD",
      "claim_boundary": "CallPresence seams remained static_limitation; no repair receipt was run."
    },
    {
      "exclusion_id": "ub-750-callpresence-limitation",
      "repository": "EffortlessMetrics/ub-review",
      "analyzed_head_sha": "6d2837252793720de9e79415261d174442e6ff43",
      "source_ref": "PR #750",
      "reason": "static_limitation_no_repair_packet",
      "evidence_ref": "target/ripr/workflow/ub750-comments.json",
      "command": "ripr review-comments --root . --base 5b01e6d19554cb4e5fe94559d487a16455d98235e5 --head HEAD",
      "claim_boundary": "CallPresence seams remained static_limitation; no repair receipt was run."
    },
    {
      "exclusion_id": "ub-742-static-limitation",
      "repository": "EffortlessMetrics/ub-review",
      "analyzed_head_sha": "01204a3c9a82a40b072b31495ffd612c36dd5a40",
      "source_ref": "PR #742",
      "reason": "static_limitation_no_repair_packet",
      "evidence_ref": "target/ripr/workflow/ub742-comments.json",
      "command": "ripr review-comments --root . --base 0f69c8253e80b0612fc4abe8effb1fd0806dbaca --head HEAD",
      "claim_boundary": "Enable-path return/call seams remained static_limitation; no repair receipt was run."
    },
    {
      "exclusion_id": "ub-747-static-limitation",
      "repository": "EffortlessMetrics/ub-review",
      "analyzed_head_sha": "fc486dc2be564c34b3047e4b5e90accc853ec13e",
      "source_ref": "PR #747",
      "canonical_candidate_id": "EffortlessMetrics/ub-review#747",
      "reason": "static_limitation_no_repair_packet",
      "evidence_ref": "target/ripr/workflow/ub747-full-comments.json",
      "command": "ripr review-comments --root . --base 23f94aa263e6b847c79078b519a76a16a7d1d14d --head HEAD",
      "claim_boundary": "Proof-planner predicate seams remained static_limitation; no repair receipt was run."
    },
    {
      "exclusion_id": "ripr-1545-static-limitation",
      "repository": "EffortlessMetrics/ripr-swarm",
      "analyzed_head_sha": "0db4754aa57845d9473ada2e73f40ede2d75138f",
      "source_ref": "PR #1545",
      "canonical_candidate_id": "EffortlessMetrics/ripr-swarm#1545",
      "reason": "static_limitation_no_repair_packet",
      "evidence_ref": "issue-comment:4950688510",
      "command": "ripr review-comments --root crates/ripr --base 76b9cec019c986e97fac0229c184fe6f2ff3bb15 --head 0db4754aa57845d9473ada2e73f40ede2d75138f",